University of Waterloo,"Harris, Randy",WATCAR,"CVAVs: speech recognition, voice interface design.",No NSERC. (Since 2005),Connected vehicles,,,,,,,,,,x,,,,,,,,,,,,,,Err:507,,,,,,,
University of Waterloo,"Heppler, Glenn",WATCAR,"Dynamics and control of structures, composite materials, materials modelling.","NSERC (Discovery Grants Program): Dynamics and Control of Micropolar Material Structures with Embedded Angular Momentum.
NSERC (Engage Grants Program): Development of Intelligent Interpolation Models Based on Limited and Expensive CFD and FEA simulations for Real-time Applications. ",Polymers and composite materials,,,,,,,,,,,,,,,,,,,,,,,,Err:507,x,,,,,,
University of Waterloo,"Hickey, Jean-Pierre",WATCAR,"Flow analysis, supercritical combustion, high-pressure fuel injector systems.",No NSERC. (Since 2012),Internal combustion engines,,,,,,,,,,,,,,,,,,,x,,,,,Err:507,,,,,,,
University of Waterloo,"Hipel, Keith",WATCAR,"Supply chain: production management, multiple objective decision making, time series analysis techniques.",NSERC (Discovery Grants Program): System of Systems Engineering Methodologies for Responsible Environmental  Management. ,Industrial processes,,,,,,,,,,,,,,,,,x,,,,,,,Err:507,,,,,,,
University of Waterloo,"Histon, Jonathan",WATCAR,"CVAVs: decision support tools for time-critical decision making, human-machine interface.",NSERC (Discovery Grants Program): Supporting Operator Complexity Management in Supervisory Control Systems. ,Connected vehicles,Injury Prevention,,,,,,,,,x,,,,,,,,x,,,,,,Err:507,,,,,,,
University of Waterloo,"Ho, Pin-Han",WATCAR,CVAVs: secure and privacy-preserving vehicular communications.,"NSERC (Discovery Grants Program): Failure Localization in all-Optical Mesh Wavelength Division Multiplexing (WDM) Networks.
NSERC (Engage Grants Program): Real-time Content Snapshot Acquisition in Billboard/Signage Networks. ",Networks and security,,,,,,,,,,,,,,,,,,,,,,,x,Err:507,,,,,,,
University of Waterloo,"Huissoon, Jan","Centre for Advanced Materials Joining
WATCAR","CVAVs: autonomous navigation using Artificial Neural Networks, robotic welding, arc acoustics in GMA welding.",No NSERC. (Since 2013),Autonomy and AI,Forming and joining,,,,,x,,,,,,,,x,,,,,,,,,,Err:507,,,,,,,
University of Waterloo,"Inal, Kaan",WATCAR,"Metal formability, deformation phenomena in materials, high performance computing and parallel computing, micromechanics.","General Motors Industrial Research Chair in Integrated Computational Mechanics for Mass Efficient Structures
NSERC (Automotive Partnership Canada Project): Sustainable lightweighting technologies: High strength, high crush efficiency extruded aluminum front rails for lightweight bodies.
NSERC (Discovery Grants Program): Multi-scale modelling of non-uniform deformation and formability in aluminum and magnesium alloys.
NSERC (Engage Grants Program): Development of Improved Material Composition and an Improved Manufacturing Process. ",Lightweight metals,Stress and fracture,Vehicle design,,,,,,,,,,,,,,,,,,x,,,,Err:507,,,,,x,,x
University of Waterloo,"Jahed, Hamid","Fatigue and Stress Analysis Lab
WATCAR","Fatigue failure analysis, fatigue life prediction, cyclic plasticity, multi-axial fatigue of magnesium alloys, mechanical testing of MEMs devices, characterizing and modelling lightweight materials behaviour under cyclic loading.","NSERC (Automotive Partnership Canada Project): Optimum design of fatigue-critical automotive components made of magnesium alloys.
NSERC (Discovery Grants Program): Next-Generation Sustainable Lightweight Fatigue-Critical Components Research. ",Stress and fracture,Lightweight metals,Nanotechnology,,,,,,,,,,,,,,,,,,x,,x,,Err:507,,,,,x,,
University of Waterloo,"Jayaram, Shesha",WATCAR,"Characterization of batteries and supercapacitors, evaluation of energy storage elements.",NSERC (Discovery Grants Program): Insulation Condition Assessment of Power System Components in the Future Smart Electricity Grid. ,Batteries and fuel cells,Transportation and charging,,,,,,x,,,,,,,,,,,,,,,,,Err:507,,,,,,x,
University of Waterloo,"Jewkes, Elizabeth",WATCAR,Supply chain: supply chain management.,No NSERC. (Since 2013),Industrial processes,,,,,,,,,,,,,,,,,x,,,,,,,Err:507,,,,,,,
University of Waterloo,"Johnson, David",WATCAR,"Powertrains and emissions: Fluid-thermal component design and analysis, incompressible flow turbomachinery.","NSERC (Discovery Grants Program): Turbine Performance and Optical Fluid Velocity Measurements with Application to Dynamic Transient Flow Over Large Scale Wind Turbine Blades. 
NSERC (Engage Grants Program): Image Analysis for Blade Defects. ",Powertrain,,,,,,,,,,,,,,,,,,,,,,,,Err:507,,x,,,,,
University of Waterloo,"Kamel, Mohamed","Centre for Pattern Analysis and Machine Intelligence
Developing Next Generation Intelligent Vehicular Networks and Applications (DIVA) Network","Data and knowledge mining, pattern recognition, cooperative intelligent systems, image processing.",,Autonomy and AI,,,,,,x,,,,,,,,,,,,,,,,,,Err:507,,,,,,,
University of Waterloo,"Karray, Fakhri","Centre for Pattern Analysis and Machine Intelligence
WATCAR","CVAVs: Autonomous/intelligent systems, computational intelligence, concept extraction and natural speech understanding.",NSERC (Discovery Grants Program): Cognitive Based Platform for Advanced Driver Assistance Systems.,Autonomy and AI,Connected vehicles,,,,,x,,,,x,,,,,,,,,,,,,,Err:507,,,,,,,
University of Waterloo,"Kazerani, Mehrdad","Waterloo Institute for Sustainable Energy
WATCAR","Active power filters, electric, hybrid and fuel cell vehicles, flexible alternative current transmission systems, fuel cell power conditioners, sustainable energy storage.",NSERC (Disocvery Grants Program): Research on Enabling Technologies for Electrification of Transporation and Integration of Renewables in Remote Communities' Microgrids.,Hybrid and electric vehicles,Powertrain,Batteries and fuel cells,,,,,x,,,,,,,,,x,,,,,,,,Err:507,,x,,,,,
University of Waterloo,"Keshav, Srinivasan",Waterloo Institute for Sustainable Energy,Distributed congestion control for electric vehicle charging.,,Transportation and charging,,,,,,,,,,,,,,,,,,,,,,,,Err:507,,,,,,x,
University of Waterloo,"Khajepour, Amir","Mechatronic Vehicle Systems Laboratory
Green Intelligent Transportation Systems
Centre for Pattern Analysis and Machine Vision
WATCAR","Advanced vehicle systems, air-gas hybrid engine, power management control strategies for electric and hybrid vehicles, embedded suspension systems, active vehicle stability, noise vibration and harshness (NVH).","Canada Research Chair in Mechatronic Vehicle Systems
NSERC (Automotive Partnership Canada): Next generation electric vehicles: development of key technologies and full vehicle testing.
Ontario Research Fund - Excellence: Green Intelligent Transportation Systems.
NSERC (Research Tools and Instruments): High Speed Hydraulic Actuators for Integration into Servo Motion Vibrational Testing Platform. 
NSERC (Engage Grants Program): Laser Hardening Development. 
NSERC (Collaborative Research and Development Grants): Development of New Technologies for Design and Popularization of Urban Vehicles. 
NSERC (Discovery Grants Program): Air-Hybrid and Fully Variable Valve Timing Systems: Improving the Efficienct of Internal Combustion Engines. ",Mechatronics,Hybrid and electric vehicles,Control,"Noise, vibration and harshness",Internal combustion engines,,,,,,,x,,,,,x,,,x,,x,,,Err:507,,,,,,,
University of Waterloo,"Khamesee, Behrad","Maglev Microrobotics Laboratory
Waterloo Institute for Sustainable Energy
WATCAR","Sensors, wind tunnel testing, electric vehicles.",NSERC (Discovery Grants Program): Sensorless Force-controlled Magnetic Micromanipulation Technology. ,Vehicle design,Hybrid and electric vehicles,,,,,,,,,,,,,,,x,,,,,,,,Err:507,,,,,,,x
University of Waterloo,"Khandani, Amir",WATCAR,CVAVs: digital and wireless communications.,"Canada Research Chair in Multiuser Wireless Communications
NSERC/Ciena Industrial Research Chair in Information Theory of Optical Networks
NSERC (Strategic Projects): Enabling Techniques for 5G Networks.
NSERC (Discovery Grants Program): Future Wireless Networks: Spectral Efficiency, Networking and Security.",Networks and security,Connected vehicles,,,,,,,,,x,,,,,,,,,,,,,x,Err:507,,,,,,,
University of Waterloo,"Kleinke, Holger","Brockhouse Institute for Materials Research
Waterloo Institute for Nanotechnology
Waterloo Institute for Sustainable Energy
WATCAR","Powertrains and emissions: thermoelectric energy conversion, inorganic materials, inorganic nanomaterials, electric vehicles.",NSERC (Discovery Grants Program): Solid State Materials Chemistry. ,Hybrid and electric vehicles,Nanotechnology,,,,,,,,,,,,,,,x,,,,,,x,,Err:507,,,,,,,
University of Waterloo,"Kulic, Dana",Centre for Pattern Analysis and Machine Intelligence,"Robotics, human-robot interaction, machine learning, mechatronics.",,Autonomy and AI,Mechatronics,,,,,x,,,,,,,,,,,,,,,x,,,Err:507,,,,,,,
University of Waterloo,"Kwon, Hyock Ju",WATCAR,Constitutive modelling of soft biopolymers.,"NSERC (Engage Grants Program): Development of Closed Fiberglass Molding Process.
NSERC (Discovery Grants Program): Measurement of 3D Cell Dynamics: Forces and Vibrations. ",Polymers and composite materials,Biocomposites,,,,,,,x,,,,,,,,,,,,,,,,Err:507,x,,,,,,
University of Waterloo,"Lambert, Steve",WATCAR,"Automotive design and engineering, drive-by-wire, electronic stability and control, fatigue and fracture.","NSERC Chair in Design Engineering
No NSERC. (Since 2015)",Vehicle design,Electronics,Stress and fracture,,,,,,,,,,,x,,,,,,,,,,,Err:507,,,,,x,,x
University of Waterloo,"Legge, Raymond",Ontario BioCar Initiative,"Proteins, bioprocessing, enzymes.",,Biocomposites,,,,,,,,x,,,,,,,,,,,,,,,,Err:507,,,,,,,
University of Waterloo,"Leung, Bosco",WATCAR,CVAVs: design of mixed analog/digital circuits for wireless communications.,NSERC (Discovery Grants Program): VLSI Design on Software Radio for Multi-Standard and Wireless Sensor Application. ,Connected vehicles,Networks and security,,,,,,,,,x,,,,,,,,,,,,,x,Err:507,,,,,,,
University of Waterloo,"Li, Xianguo","Waterloo Institute for Sustainable Energy
WATCAR","Energy and exergy, energy conversion, fuel atomization and spray formation, fuel cell performance, heat transfer, life cycle analysis, modelling transport phenomena in fuel cells, design and fabrication of fuel cell components, electric vehicles.","Ontario Research Fund - Excellence: Green Auto Power Train.
NSERC (Discovery Grants Program): Transport Phenomena in Energy Conversion Systems. 
NSERC (Engage Grants Program): Assessment of Capacity Fade in Lithium Batteries. ",Batteries and fuel cells,Hybrid and electric vehicles,Powertrain,,,,,x,,,,,,,,,x,,,,,,,,Err:507,,x,,,,,
University of Waterloo,"Lien, Fue-Sang",WATCAR,"Aerodynamics and aeroacoustics, turbulence modelling, wind engineering and dispersion.",NSERC (Discovery Grants Program): Numerical Predicition of Wind Turbine Noise Using Large Eddy Simulation. ,Vehicle design,"Noise, vibration and harshness",,,,,,,,,,,,,,,,,,,,,,,Err:507,,,,,,,x
University of Waterloo,"MacGregor, Carolyn",WATCAR,"CVAVs: driver performance and safety, individual differences and information manipulation, usability testing and human-computer interactions.",No NSERC. (Since 2014),Connected vehicles,Injury Prevention,,,,,,,,,x,,,,,,,,x,,,,,,Err:507,,,,,,,
University of Waterloo,"Madhuranthakam, Chandra",WATCAR,"Emulsion rubber, microfluidics.",No NSERC.  ,Other,,,,,,,,,,,,,,,,,,,,,,,,Err:507,,,,,,,
University of Waterloo,"Maitland, Anson",Motion Research Group,"Model Reduction, optimal control, nonlinear/hybrid systems. ",NSERC (Postgraduate Scholarships): Structure-Preserving Model Reduction of Automotive Systems.,Control,,,,,,,,,,,x,,,,,,,,,,,,,Err:507,,,,,,,
University of Waterloo,"Mansour, Raafat","Waterloo Institute for Nanotechnology
WATCAR","Nano-based sensors, micro-electro-mechanical systems (MEMS).","Canada Research Chair in Micro and Nano Integrated RF Systems
Ontario Research Fund - Excellence: Advancing Nanotechnology: Development of Novel Scanning Probe Tools for Applications in Atomically Precise Fabrication, Characterization and Metrology.
NSERC (Research Tools and Instruments): Ion Beam Milling System. 
NSERC (Discovery Grants Program): Advanced CMOS-MEMS RF Devices. 
NSERC (Collaborative Research and Development Grants): High-Q Tunable Filters for Wireless Systems. ",Sensors,Nanotechnology,,,,,,,,,,,,,,,,,,,,,x,,Err:507,,,x,,,,
University of Waterloo,"Mayer, Michael","Centre for Advanced Materials Joining
WATCAR","Microfabrication, microjoining processes, thermosonic and ultrasonic wire bonding, sensor technology.",NSERC (Engage Grants Program): Resistance monitoring of novel solders during processing and operation at high temperatures.,Forming and joining,Nanotechnology,Sensors,,,,,,,,,,,,x,,,,,,,,x,,Err:507,,,x,,,,
University of Waterloo,"McKay, Kenneth",WATCAR,"Supply chain: auto manufacturing efficiencies, adaptive control heuristics for production control, lean supply chain strategies, threat detection frameworks.",No NSERC. (Since 2015),Industrial processes,,,,,,,,,,,,,,,,,x,,,,,,,Err:507,,,,,,,
University of Waterloo,"McManus, Neil","Institute for Polymer Research
WATCAR","Polymer engineering, chemical modification of polymers, free radical polymerization kinetics.",No NSERC. (Since 2011),Polymers and composite materials,,,,,,,,,,,,,,,,,,,,,,,,Err:507,x,,,,,,
University of Waterloo,"McPhee, John","Green and Intelligent Automotive (GAIA) Research Facility
Waterloo Institute for Sustainable Energy
WATCAR","Automotive system modelling, multibody dynamics and vehicle design optimization, real-time simulation, vehicle dynamics, electric vehicles.","NSERC/Toyota/Maplesoft Industrial Research Chair in Mathematics-Based Modelling and Design
Canada Research Chair in Biomechatronic System Dynamics
NSERC (Collaborative Research and Development Grants): Mathematics-based modelling and model reduction for automotive systems.
Ontario Research Fund - Infrastructure: Green and Intelligent Automotive (GAIA) Research Facility.
Canadian Foundation for Innovation: Green and Intelligent Automotive (GAIA) Research Facility.
NSERC (Discovery Grants Program): Multibody Dynamics, Simulation, and Parameter Identification of 3D Biomechanical Systems. ",Vehicle design,Control,Hybrid and electric vehicles,,,,,,,,,x,,,,,x,,,,,,,,Err:507,,,,,,,x
University of Waterloo,"Melek, William","Centre for Pattern Analysis and Machine Intelligence
WATCAR","CVAVs: autonomous navigation  and mobile manipulation, computational intelligence, design, modelling and control of advanced mechatronics.",NSERC (Discovery Grants Program):  Configuration Optimization and Advanced Docking Design for Two Classes of Reconfigurable Robotic Systems.,Autonomy and AI,Mechatronics,,,,,x,,,,,,,,,,,,,,,x,,,Err:507,,,,,,,
University of Waterloo,"Mitran, Patrick",WATCAR,"CVAVs: cooperative and cognitive networks, wireless communications.",NSERC (Discovery Grants Program):  Performance limits and advanced methods in wireless networks.,Networks and security,,,,,,,,,,,,,,,,,,,,,,,x,Err:507,,,,,,,
University of Waterloo,"Montesano, John",WATCAR,"Long-term durability of lightweight components, fatigue and creep failure, impact of composite structures, damage mechanics and modelling, non-destructive evaluation.",No NSERC. ,Lightweight metals,Polymers and composite materials,Crashworthiness,,,,,,,,,,x,,,,,,,,x,,,,Err:507,x,,,,,,
University of Waterloo,"Moreno, Carlos",Real-Time Embedded Software Research Group,"Cryptography, embedded systems security, digital signal processing, automotive functional safety.",,Networks and security,Injury Prevention,,,,,,,,,,,,,,,,,x,,,,,x,Err:507,,,,,,,
University of Waterloo,"Moresoli, Christine",Ontario BioCar Initiative,"Diffusion transport and stress in biomaterials and polymeric films, enzyme reaction engineering.",,Biocomposites,Polymers and composite materials,Stress and fracture,,,,,,x,,,,,,,,,,,,,,,,Err:507,x,,,,x,,
University of Waterloo,"Morris, Kirsten",WATCAR,"Estimation of charge in batteries, control of smart materials, optimization of sensor and hardware placement.",NSERC (Discovery Grants Program):  Integrated Actuator/Sensor Design for Control of Distributed Parameter Systems.,Batteries and fuel cells,Sensors,,,,,,x,,,,,,,,,,,,,,,,,Err:507,,,x,,,,
University of Waterloo,"Naik, Sagar",WATCAR,"CVAVs: intelligent transportation systems, mobile networks, smart grids.","NSERC (Discovery Grants Program):  EnergyMass: Energy Efficiency of Mobile Applications on Smartphones and Small Devices.
NSERC (Collaborative Research and Development Grants): Dependable Execution of Applications on Smartphones.",Transportation and charging,Networks and security,,,,,,,,,,,,,,,,,,,,,,x,Err:507,,,,,,x,
University of Waterloo,"Narasimhan, Sriram","Structural Dynamics, Control and Identification Group
WATCAR","Noise, vibration and harshness (NVH), wave propagation in composite materials.","Canada Research Chair in Smart Infrastructure
NSERC (Discovery Grants Program): System Identification of Dynamically Sensitive Structures using Wireless Smart Sensor Networks.","Noise, vibration and harshness",Polymers and composite materials,Networks and security,Sensors,,,,,,,,,,,,,,,,,,,,x,Err:507,x,,x,,,,
University of Waterloo,"Nasser, Abukhdeir","Waterloo Institute for Nanotechnology
WATCAR","Hydrodynamics of complex fluids and multiphase flows, topological optimization of structural analysis.","NSERC (Discovery Grants Program): Simulation-based Engineering of Micro/Nanoscale Liquid Crystal Devices.
NSERC (Collaborative Research and Development Grants): Simulation-assisted design and optimization of multiphase unit operations for Canadian bitumen processing.
NSERC (Engage Grants Program): Simulation-based analysis of phase-change cooling mechanisms for integral molten salt reactors.
NSERC (Engage Grants Program): Simulation-assisted design of an integrated microfluidic centrifugal separator.",Nanotechnology,,,,,,,,,,,,,,,,,,,,,,x,,Err:507,,,,,,,
University of Waterloo,"Nazar, Linda","Waterloo Institute for Nanotechnology
Waterloo Institute for Sustainable Energy
WATCAR","Advanced nano materials for rechargeable lithium-ion batteries, new materials for enhanced energy storage and conversion, hydrogen storage and fuel cell catalyst materials, electric vehicles","Canada Research Chair in Solid State Materials
NSERC (Discovery Grants Program): Energy Storage Materials: Discovery and Electrochemistry.",Batteries and fuel cells,Nanotechnology,Hybrid and electric vehicles,,,,,x,,,,,,,,,x,,,,,,x,,Err:507,,,,,,,
University of Waterloo,"Ng, Flora","Waterloo Institute for Nanotechnology
Waterloo Institute for Sustainable Energy
WATCAR","Catalyst development for hydrocarbon processing, heavy oil and emulsion upgrading, production of ultra-low sulphur gasoline and diesel fuel, biodiesel production.",NSERC (Discovery Grants Program):  Production of clean and renewable energy and chemicals from biomass and oilsands bitumen.,Alternative fuels,,,,,x,,,,,,,,,,,,,,,,,,,Err:507,,,,,,,
University of Waterloo,"Nieva, Patricia","Sensors and Integrated Microsystems Laboratory
Waterloo Institute for Nanotechnology
WATCAR","Micro- and nano-electro-mechanical systems (MEMS/NEMS) sensors for operation in harsh environments, sensor monitoring of lithium-ion batteries in electric vehicles.",NSERC (Discovery Grants Programs): Development of Harsh Environment MEMS Sensors for Greener Internal Combustion Engines.,Nanotechnology,Electronics,Sensors,Batteries and fuel cells,Hybrid and electric vehicles,,,x,,,,,,x,,,x,,,,,,x,,Err:507,,,x,,,,
University of Waterloo,"Papoulia, Katerina",WATCAR,"Computational solid mechanics, failure analysis and cohesive fracture of polymeric and glassy materials, modelling of concrete and polymer-based composites.",No NSERC. (Since 2013),Polymers and composite materials,Stress and fracture,,,,,,,,,,,,,,,,,,,,,,,Err:507,x,,,,x,,
University of Waterloo,"Penlidis, Alexander","Institute for Polymer Research
WATCAR","Modelling of polymer reactors, emulsion/solution/suspension polymerization, polymer characterization, polymer engineering, polymerization kinetics, engineering polymers with specific properties for advanced technology applications.","Former Canada Research Chair in Engineering of Polymers with Tailor-Made Properties
NSERC (Discovery Grants Program):  Issues in multicomponent polymerizations polymeric sensor development.",Polymers and composite materials,Sensors,,,,,,,,,,,,,,,,,,,,,,,Err:507,x,,x,,,,
University of Waterloo,"Pritzker, Mark","Waterloo Institute for Sustainable Energy
WATCAR","Metal and alloy electrodeposition, proton exchange membrane fuel cell (PEMFC) and solid oxide fuel cell (SOFC) modelling, electrochemical techniques for fabricating nanostructures, electric vehicles.","NSERC (Discovery Grants Program): Electrochemical Deposition for Electrochemical Energy Applications.
NSERC (Engage Grants Program):  Formulation of zinc oxide nanoparticle dispersions for metal oxide solar cells.",Lightweight metals,Batteries and fuel cells,Nanotechnology,Hybrid and electric vehicles,,,,x,,,,,,,,,x,,,,x,,x,,Err:507,,,,,,,
University of Waterloo,"Rafi, Golamreza",Centre for Intelligent Antenna and Radio Systems,"Mobile satellite broadcasting and communications in vehicles, vehicle mounted antennas for satellite services in moving vehicles, satellite tracking for fast moving conditions.",,Connected vehicles,Networks and security,,,,,,,,,x,,,,,,,,,,,,,x,Err:507,,,,,,,
University of Waterloo,"Randall, Neil",WATCAR,CVAVs: rhetorical and semiotic analysis of user interfaces.,No NSERC.,Connected vehicles,,,,,,,,,,x,,,,,,,,,,,,,,Err:507,,,,,,,
University of Waterloo,"Rempel, Gary",WATCAR,"Advanced rubber materials, chemical modification of polymers, green catalytic processes.","NSERC (Collaborative Research and Development Grants): Novel elastomers.
NSERC (Discovery Grants Program): Green and sustainable catalytic technology for advanced materials.",Polymers and composite materials,,,,,,,,,,,,,,,,,,,,,,,,Err:507,x,,,,,,
University of Waterloo,"Rosenberg, Catherine","Waterloo Institute for Sustainable Energy
WATCAR","CVAVs: network security, traffic engineering and congestion control, V2X communications, electric vehicles and grid charging.","Canada Research Chair in Future Internet
NSERC (Discovery Grants Program):  Smart Energy Systems: Control, Communications, and Optimization.",Networks and security,Transportation and charging,Connected vehicles,Hybrid and electric vehicles,,,,,,,x,,,,,,x,,,,,,,x,Err:507,,,,,,x,
University of Waterloo,"Saccomanno, Frank",WATCAR,"Driver fatigue and accident severity, road accident prediction, transportation of dangerous goods.",No NSERC. (Since 2015),Injury Prevention,Transportation and charging,,,,,,,,,,,,,,,,,x,,,,,,Err:507,,,,,,x,
University of Waterloo,"Safavi-Naeini, Safieddin","Centre for Intelligent Antenna and Radio Systems
WATCAR","CVAVs: vehicle wireless communications and safety systems, intelligent navigation systems.","NSERC-Blackberry Industrial Research Chair in Intelligent Integrated Radio/Antenna Systems and Novel Electromagnetic Media Technologies
NSERC (Engage Grants Program):  Low-cost high performance antenna system for UAV-ground communication.
NSERC (Discovery Grants Program):  Integrated millimeter-wave/terahertz smart structures.",Connected vehicles,Networks and security,Injury Prevention,,,,,,,,x,,,,,,,,x,,,,,x,Err:507,,,,,,,
University of Waterloo,"Safayeni, Frank",WATCAR,"Supply chain: production management, behavioural and organizational aspects of information systems and management technology.",No NSERC.,Industrial processes,,,,,,,,,,,,,,,,,x,,,,,,,Err:507,,,,,,,
University of Waterloo,"Salama, Magdy","Waterloo Institute for Sustainable Energy
WATCAR","Energy systems, distribution system automation, performance, and load management, power grids and electric vehicle charging.",NSERC (Discovert Grants Program):  Performance of smart distribution systems (SDS) with large-scale renewable energy sources (LSRES).,Transportation and charging,,,,,,,,,,,,,,,,,,,,,,,,Err:507,,,,,,x,
University of Waterloo,"Salehian, Armaghan",WATCAR,"Noise vibration and harshness (NVH), wave propogation in composite materials.",,"Noise, vibration and harshness",Polymers and composite materials,,,,,,,,,,,,,,,,,,,,,,,Err:507,x,,,,,,
University of Waterloo,"Sazonov, Andrei","Waterloo Institute for Nanotechnology
WATCAR","Thin film materials for electronics and sensors applications, fabrication of low-cost flexible electronics.",NSERC (Engage Grants Program): Computer implementation of physical models for exciton and charge transport in organic semiconductor devices.,Electronics,Sensors,Nanotechnology,,,,,,,,,,,x,,,,,,,,,x,,Err:507,,,x,,,,
University of Waterloo,"Schneider, Gary",WATCAR,"All-speed flow prediction, machine vision.",No NSERC. (Since 2015),Autonomy and AI,,,,,,x,,,,,,,,,,,,,,,,,,Err:507,,,,,,,
University of Waterloo,"Shahrivar, Ebrahim Moradi",Smart Hybrid and Electric Vehicle Systems Lab,"Optimal control, distributed control systems, network science, machine learning.",,Control,Autonomy and AI,,,,,x,,,,,x,,,,,,,,,,,,,Err:507,,,,,,,
University of Waterloo,"Shaker, George","Centre for Intelligent Antenna and Radio Systems
WATCAR","CVAVs: vehicle and UAV wireless communications, navigation and telematics systems.
Powertrains: energy harvesting systems.",No NSERC. (Since 2010),Networks and security,Connected vehicles,Autonomy and AI,Powertrain,,,x,,,,x,,,,,,,,,,,,,x,Err:507,,x,,,,,
